{
  "schemaVersion": 1,
  "version": "v2.6.0",
  "state": "required-not-collected",
  "mandatory": [
    "requirements",
    "rfc",
    "adr",
    "threat-model",
    "privacy-review",
    "readiness-scorecard",
    "tests",
    "security",
    "accessibility",
    "performance",
    "migration",
    "rollback",
    "documentation-impact",
    "compatibility",
    "sbom",
    "provenance",
    "release-verification",
    "post-release-review"
  ],
  "gates": {
    "critical": 100,
    "important": 95,
    "standard": 90
  },
  "acceptance": [
    "Unused, duplicate, incompatible, risky, and update recommendations link to local evidence.",
    "VS Code, JetBrains, Cursor, Codex, CLI, desktop, and cloud bridges use shared APIs and loss reports.",
    "Analytics remain disabled unless explicit, revocable consent exists."
  ]
}
