{
  "schemaVersion": 1,
  "version": "v2.0.0",
  "state": "required-not-collected",
  "mandatory": [
    "requirements",
    "rfc",
    "adr",
    "threat-model",
    "privacy-review",
    "readiness-scorecard",
    "tests",
    "security",
    "accessibility",
    "performance",
    "migration",
    "rollback",
    "documentation-impact",
    "compatibility",
    "sbom",
    "provenance",
    "release-verification",
    "post-release-review"
  ],
  "gates": {
    "critical": 100,
    "important": 95,
    "standard": 90
  },
  "acceptance": [
    "SSO/OIDC, RBAC, tenant isolation, encrypted synchronization, conflict resolution, key rotation, backup, and disaster recovery pass.",
    "1.x migration is preview-first and reversible.",
    "Independent security review and outage exercises pass."
  ]
}
