{
  "schemaVersion": 1,
  "version": "v2.3.0",
  "state": "required-not-collected",
  "mandatory": [
    "requirements",
    "rfc",
    "adr",
    "threat-model",
    "privacy-review",
    "readiness-scorecard",
    "tests",
    "security",
    "accessibility",
    "performance",
    "migration",
    "rollback",
    "documentation-impact",
    "compatibility",
    "sbom",
    "provenance",
    "release-verification",
    "post-release-review"
  ],
  "gates": {
    "critical": 100,
    "important": 95,
    "standard": 90
  },
  "acceptance": [
    "Global, organization, workspace, project, shared, and read-only scope precedence passes.",
    "Install, update, remove, rollback, health, and history are fully evidenced.",
    "Ranking is explainable, neutral, and policy-aware."
  ]
}
