{
  "schemaVersion": 1,
  "version": "v2.1.0",
  "state": "required-not-collected",
  "mandatory": [
    "requirements",
    "rfc",
    "adr",
    "threat-model",
    "privacy-review",
    "readiness-scorecard",
    "tests",
    "security",
    "accessibility",
    "performance",
    "migration",
    "rollback",
    "documentation-impact",
    "compatibility",
    "sbom",
    "provenance",
    "release-verification",
    "post-release-review"
  ],
  "gates": {
    "critical": 100,
    "important": 95,
    "standard": 90
  },
  "acceptance": [
    "Local registry, content cache, resolver, signatures, rollback, and corruption recovery pass.",
    "Existing capability contracts remain compatible through adapters.",
    "Namespaced extension types do not require resolver changes."
  ]
}
