{
  "schemaVersion": 1,
  "version": "v3.0.0",
  "state": "required-not-collected",
  "mandatory": [
    "requirements",
    "rfc",
    "adr",
    "threat-model",
    "privacy-review",
    "readiness-scorecard",
    "tests",
    "security",
    "accessibility",
    "performance",
    "migration",
    "rollback",
    "documentation-impact",
    "compatibility",
    "sbom",
    "provenance",
    "release-verification",
    "post-release-review"
  ],
  "gates": {
    "critical": 100,
    "important": 95,
    "standard": 90
  },
  "acceptance": [
    "Two release candidates pass migration, rollback, disaster recovery, federation, and offline rehearsals.",
    "Project digital twins and evidence graphs remain metadata-minimized and explainable.",
    "Human authority governs mutation, deployment, billing, publication, trust, and policy promotion."
  ]
}
