{
  "schemaVersion": 1,
  "version": "v2.5.0",
  "state": "required-not-collected",
  "mandatory": [
    "requirements",
    "rfc",
    "adr",
    "threat-model",
    "privacy-review",
    "readiness-scorecard",
    "tests",
    "security",
    "accessibility",
    "performance",
    "migration",
    "rollback",
    "documentation-impact",
    "compatibility",
    "sbom",
    "provenance",
    "release-verification",
    "post-release-review"
  ],
  "gates": {
    "critical": 100,
    "important": 95,
    "standard": 90
  },
  "acceptance": [
    "Private catalogs, approvals, delegated roles, promotion, inventory, and audit pass.",
    "Tenant isolation and offline enterprise workflows pass.",
    "Dependency impact previews expose conflicts before promotion."
  ]
}
