{
  "schemaVersion": 1,
  "version": "v2.4.0",
  "state": "required-not-collected",
  "mandatory": [
    "requirements",
    "rfc",
    "adr",
    "threat-model",
    "privacy-review",
    "readiness-scorecard",
    "tests",
    "security",
    "accessibility",
    "performance",
    "migration",
    "rollback",
    "documentation-impact",
    "compatibility",
    "sbom",
    "provenance",
    "release-verification",
    "post-release-review"
  ],
  "gates": {
    "critical": 100,
    "important": 95,
    "standard": 90
  },
  "acceptance": [
    "Malicious packages remain quarantined and isolated.",
    "Capability Studio profiles generate valid packages and evidence.",
    "Deprecation, withdrawal, ownership transfer, recovery, and dispute flows pass."
  ]
}
