{
  "schemaVersion": 1,
  "version": "v1.4.0",
  "state": "required-not-collected",
  "mandatory": [
    "requirements",
    "rfc",
    "adr",
    "threat-model",
    "privacy-review",
    "readiness-scorecard",
    "tests",
    "security",
    "accessibility",
    "performance",
    "migration",
    "rollback",
    "documentation-impact",
    "compatibility",
    "sbom",
    "provenance",
    "release-verification",
    "post-release-review"
  ],
  "gates": {
    "critical": 100,
    "important": 95,
    "standard": 90
  },
  "acceptance": [
    "OpenAI, Anthropic, Gemini, OpenRouter, and Ollama adapters pass deterministic fixtures and credential-gated smoke tests.",
    "Retries honor Retry-After, deadlines, cancellation, budgets, and idempotency.",
    "Prompts, responses, credentials, and authorization headers are absent from logs and diagnostics."
  ]
}
