{
  "schemaVersion": 1,
  "version": "v1.7.0",
  "state": "required-not-collected",
  "mandatory": [
    "requirements",
    "rfc",
    "adr",
    "threat-model",
    "privacy-review",
    "readiness-scorecard",
    "tests",
    "security",
    "accessibility",
    "performance",
    "migration",
    "rollback",
    "documentation-impact",
    "compatibility",
    "sbom",
    "provenance",
    "release-verification",
    "post-release-review"
  ],
  "gates": {
    "critical": 100,
    "important": 95,
    "standard": 90
  },
  "acceptance": [
    "Deny overrides all allow paths and is tested across commands.",
    "Environment overlays have deterministic precedence.",
    "Unsigned or unapproved artifacts require explicit governed approval."
  ]
}
